Sample_file	Genome_file	Taxonomic_abundance	Sequence_abundance	Adjusted_ANI	Eff_cov	ANI_5-95_percentile	Eff_lambda	Lambda_5-95_percentile	Median_cov	Mean_cov_geq1	Containment_ind	Naive_ANI	kmers_reassigned	Contig_name
ERR4757837_trimmed_1.fastq.gz	GCF_000014465.1.fna	72.0268	72.6240	99.64	29.000	NA-NA	HIGH	NA-NA	29	29.646	8946/10002	99.64	0	NC_008497.1 Levilactobacillus brevis ATCC 367, complete sequence
ERR4757837_trimmed_1.fastq.gz	GCF_000007525.1.fna	11.2639	10.9692	99.10	4.535	NA-NA	HIGH	NA-NA	4	4.535	7239/9595	99.10	0	NC_004307.2 Bifidobacterium longum NCC2705, complete sequence
ERR4757837_trimmed_1.fastq.gz	GCF_000014445.1.fna	8.4696	7.5748	99.47	3.410	NA-NA	HIGH	NA-NA	3	3.410	7525/8862	99.47	2	NC_008531.1 Leuconostoc mesenteroides subsp. mesenteroides ATCC 8293, complete sequence
ERR4757837_trimmed_1.fastq.gz	GCA_014058685.1.fna	4.1035	3.4501	98.08	1.652	97.93-98.16	1.652	1.56-1.78	2	2.263	3553/8025	97.41	1	CP059055.1 Lactobacillus johnsonii strain NCK2677 chromosome, complete genome
ERR4757837_trimmed_1.fastq.gz	GCF_000014525.1.fna	1.9504	2.4575	98.90	0.785	98.75-99.05	0.785	0.74-0.84	1	1.491	4624/11907	96.99	3	NC_008526.1 Lacticaseibacillus paracasei ATCC 334, complete sequence
ERR4757837_trimmed_1.fastq.gz	GCF_018351295.1.fna	1.6767	2.4227	98.82	0.675	98.68-98.98	0.675	0.63-0.72	1	1.392	5046/14497	96.65	37	NZ_CP063750.1 Lactiplantibacillus plantarum strain ATCC 202195 chromosome, complete genome
ERR4757837_trimmed_1.fastq.gz	GCF_000014545.1.fna	0.2840	0.3180	98.90	0.114	98.11-99.54	0.114	0.09-0.15	1	1.097	804/10467	92.05	13	NC_008527.1 Lactococcus cremoris subsp. cremoris SK11, complete sequence
ERR4757837_trimmed_1.fastq.gz	GCA_000014425.1.fna	0.2251	0.1837	97.88	0.091	96.29-99.06	0.091	0.06-0.13	1	1.189	338/7578	90.45	208	CP000413.1 Lactobacillus gasseri ATCC 33323, complete genome
