Sample_file	Genome_file	Taxonomic_abundance	Sequence_abundance	Adjusted_ANI	Eff_cov	ANI_5-95_percentile	Eff_lambda	Lambda_5-95_percentile	Median_cov	Mean_cov_geq1	Containment_ind	Naive_ANI	kmers_reassigned	Contig_name
ERR4757856_trimmed_1.fastq.gz	GCF_000014445.1.fna	67.8929	64.7011	99.36	10.649	NA-NA	HIGH	NA-NA	11	10.649	7259/8862	99.36	1	NC_008531.1 Leuconostoc mesenteroides subsp. mesenteroides ATCC 8293, complete sequence
ERR4757856_trimmed_1.fastq.gz	GCF_000006865.1.fna	12.2273	13.2794	99.89	1.918	99.70-99.95	1.918	1.82-2.31	2	2.798	8036/9757	99.38	0	NC_002662.1 Lactococcus lactis subsp. lactis Il1403, complete sequence
ERR4757856_trimmed_1.fastq.gz	GCF_000007525.1.fna	5.9118	6.1346	99.03	0.927	98.89-99.17	0.927	0.87-0.98	1	1.542	4289/9595	97.44	0	NC_004307.2 Bifidobacterium longum NCC2705, complete sequence
ERR4757856_trimmed_1.fastq.gz	GCF_000014545.1.fna	4.0957	4.8858	99.39	0.642	99.20-99.58	0.642	0.60-0.69	1	1.565	4158/10467	97.07	640	NC_008527.1 Lactococcus cremoris subsp. cremoris SK11, complete sequence
ERR4757856_trimmed_1.fastq.gz	GCF_000214785.1.fna	3.9719	4.2927	99.69	0.623	99.55-99.85	0.623	0.58-0.66	1	1.367	4065/9636	97.25	25	NC_015602.1 Lactobacillus kefiranofaciens subsp. kefiranofaciens, complete sequence
ERR4757856_trimmed_1.fastq.gz	GCA_014058685.1.fna	2.7891	2.4987	97.82	0.437	97.46-98.12	0.437	0.39-0.49	1	1.234	1435/8025	94.60	11	CP059055.1 Lactobacillus johnsonii strain NCK2677 chromosome, complete genome
ERR4757856_trimmed_1.fastq.gz	GCF_009739535.1.fna	1.6218	1.8532	99.98	0.254	99.64-100.31	0.254	0.23-0.28	1	1.175	2325/10398	95.28	0	NZ_CP029971.1 Lentilactobacillus kefiri strain DH5 chromosome, complete genome
ERR4757856_trimmed_1.fastq.gz	GCF_000014525.1.fna	1.2770	1.7145	98.87	0.200	98.46-99.32	0.200	0.17-0.23	1	1.148	1537/11907	93.61	26	NC_008526.1 Lacticaseibacillus paracasei ATCC 334, complete sequence
ERR4757856_trimmed_1.fastq.gz	GCF_018289135.1.fna	0.2125	0.6399	95.03	0.033	92.27-95.70	0.033	0.03-0.08	1	1.016	183/27084	85.11	0	NZ_CP072216.1 Bacteroides xylanisolvens strain CL11T00C03 chromosome, complete genome
