Sample_file	Genome_file	Taxonomic_abundance	Sequence_abundance	Adjusted_ANI	Eff_cov	ANI_5-95_percentile	Eff_lambda	Lambda_5-95_percentile	Median_cov	Mean_cov_geq1	Containment_ind	Naive_ANI	kmers_reassigned	Contig_name
SRR11605270_trimmed_1.fastq.gz	GCF_000014525.1.fna	44.6400	48.0814	98.74	225.000	NA-NA	HIGH	NA-NA	225	225.821	8045/11907	98.74	4	NC_008526.1 Lacticaseibacillus paracasei ATCC 334, complete sequence
SRR11605270_trimmed_1.fastq.gz	GCF_000011985.1.fna	17.0624	12.5284	99.99	86.000	NA-NA	HIGH	NA-NA	86	88.087	8392/8425	99.99	0	NC_006814.3 Lactobacillus acidophilus NCFM, complete sequence
SRR11605270_trimmed_1.fastq.gz	GCF_018351295.1.fna	14.2848	17.6452	99.13	72.000	NA-NA	HIGH	NA-NA	72	74.299	11064/14497	99.13	6	NZ_CP063750.1 Lactiplantibacillus plantarum strain ATCC 202195 chromosome, complete genome
SRR11605270_trimmed_1.fastq.gz	GCA_002914895.1.fna	12.1024	8.5429	100.00	61.000	NA-NA	HIGH	NA-NA	61	64.312	8356/8359	100.00	0	NIGQ01000001.1 Bifidobacterium animalis subsp. lactis strain LMG P-17502_2 contig000001, whole genome shotgun sequence
SRR11605270_trimmed_1.fastq.gz	GCF_000026505.1.fna	11.9040	13.1978	98.20	60.000	NA-NA	HIGH	NA-NA	60	58.462	7067/12422	98.20	147	NC_013198.1 Lacticaseibacillus rhamnosus GG, complete sequence
SRR11605270_trimmed_1.fastq.gz	GCF_000014485.1.fna	0.0063	0.0043	100.00	0.032	97.48-101.65	0.032	0.02-0.06	1	0.992	262/7600	89.71	0	NC_008532.1 Streptococcus thermophilus LMD-9, complete sequence
