Sample_file	Genome_file	Taxonomic_abundance	Sequence_abundance	Adjusted_ANI	Eff_cov	ANI_5-95_percentile	Eff_lambda	Lambda_5-95_percentile	Median_cov	Mean_cov_geq1	Containment_ind	Naive_ANI	kmers_reassigned	Contig_name
SRR2182533_trimmed_1.fastq.gz	GCF_000011985.1.fna	49.7795	46.7502	99.99	410.000	NA-NA	HIGH	NA-NA	410	417.747	8397/8425	99.99	0	NC_006814.3 Lactobacillus acidophilus NCFM, complete sequence
SRR2182533_trimmed_1.fastq.gz	GCF_000007525.1.fna	25.6183	27.2780	99.17	211.000	NA-NA	HIGH	NA-NA	211	210.709	7410/9595	99.17	11	NC_004307.2 Bifidobacterium longum NCC2705, complete sequence
SRR2182533_trimmed_1.fastq.gz	GCA_002914895.1.fna	13.2341	11.9482	100.00	109.000	NA-NA	HIGH	NA-NA	109	113.966	8356/8359	100.00	0	NIGQ01000001.1 Bifidobacterium animalis subsp. lactis strain LMG P-17502_2 contig000001, whole genome shotgun sequence
SRR2182533_trimmed_1.fastq.gz	GCA_036281515.1.fna	4.6137	5.1639	98.73	38.000	NA-NA	HIGH	NA-NA	38	42.863	6852/10190	98.73	799	QQNM01000001.1 UNVERIFIED_CONTAM: Bifidobacterium breve strain M16-V NODE_1_length_908942_cov_58.595_ID_1, whole genome shotgun sequence
SRR2182533_trimmed_1.fastq.gz	GCA_001044095.1.fna	2.9139	3.6898	98.12	24.000	NA-NA	HIGH	NA-NA	24	24.613	6258/11256	98.12	146	JUIN01000001.1 Lacticaseibacillus rhamnosus strain Lr032 contig00001, whole genome shotgun sequence
SRR2182533_trimmed_1.fastq.gz	GCF_000829055.1.fna	1.4212	1.9770	100.00	11.705	NA-NA	HIGH	NA-NA	11	11.705	11728/11730	100.00	0	NZ_AP012544.1 Lacticaseibacillus casei DSM 20011 = JCM 1134 = ATCC 393 chromosome, complete genome
SRR2182533_trimmed_1.fastq.gz	GCF_018351295.1.fna	1.3777	2.1767	99.18	11.347	NA-NA	HIGH	NA-NA	11	11.347	11219/14497	99.18	21	NZ_CP063750.1 Lactiplantibacillus plantarum strain ATCC 202195 chromosome, complete genome
SRR2182533_trimmed_1.fastq.gz	GCA_035231985.1.fna	1.0416	1.0163	97.90	8.579	NA-NA	HIGH	NA-NA	8	8.579	4380/8468	97.90	9	CP117983.1 Ligilactobacillus salivarius strain B4311 chromosome, complete genome
