Sample_file	Genome_file	Taxonomic_abundance	Sequence_abundance	Adjusted_ANI	Eff_cov	ANI_5-95_percentile	Eff_lambda	Lambda_5-95_percentile	Median_cov	Mean_cov_geq1	Containment_ind	Naive_ANI	kmers_reassigned	Contig_name
SRR25394929_trimmed_1.fastq.gz	GCF_000014485.1.fna	99.0164	98.8920	99.70	2314.000	NA-NA	HIGH	NA-NA	2314	2148.056	6928/7600	99.70	0	NC_008532.1 Streptococcus thermophilus LMD-9, complete sequence
SRR25394929_trimmed_1.fastq.gz	GCF_000056065.1.fna	0.7274	0.7268	97.97	17.000	NA-NA	HIGH	NA-NA	17	17.676	3942/7436	97.97	19	NC_008054.1 Lactobacillus delbrueckii subsp. bulgaricus ATCC 11842 = JCM 1002, complete sequence
SRR25394929_trimmed_1.fastq.gz	GCF_000014525.1.fna	0.1841	0.2884	98.75	4.302	NA-NA	HIGH	NA-NA	4	4.302	8072/11907	98.75	0	NC_008526.1 Lacticaseibacillus paracasei ATCC 334, complete sequence
SRR25394929_trimmed_1.fastq.gz	GCF_000006865.1.fna	0.0604	0.0766	98.96	1.412	98.88-99.03	1.412	1.34-1.49	2	1.883	5347/9757	98.08	14	NC_002662.1 Lactococcus lactis subsp. lactis Il1403, complete sequence
SRR25394929_trimmed_1.fastq.gz	GCF_000014545.1.fna	0.0116	0.0162	97.64	0.272	97.20-98.09	0.272	0.23-0.31	1	1.347	1196/10467	93.24	550	NC_008527.1 Lactococcus cremoris subsp. cremoris SK11, complete sequence
