Sample_file	Genome_file	Taxonomic_abundance	Sequence_abundance	Adjusted_ANI	Eff_cov	ANI_5-95_percentile	Eff_lambda	Lambda_5-95_percentile	Median_cov	Mean_cov_geq1	Containment_ind	Naive_ANI	kmers_reassigned	Contig_name
SRR27593210_trimmed_1.fastq.gz	GCF_000010145.1.fna	53.7207	18.2031	98.40	16.000	NA-NA	HIGH	NA-NA	16	15.679	5074/8356	98.40	0	NC_010610.1 Limosilactobacillus fermentum IFO 3956, complete sequence
SRR27593210_trimmed_1.fastq.gz	GCF_000146045.2.fna	40.3589	79.2182	99.39	12.020	NA-NA	HIGH	NA-NA	12	12.020	40876/49417	99.39	0	NC_001133.9 Saccharomyces cerevisiae S288C chromosome I, complete sequence
SRR27593210_trimmed_1.fastq.gz	GCF_000010825.1.fna	2.7817	1.5002	98.57	0.828	98.43-98.71	0.828	0.78-0.88	1	1.667	4718/13089	96.76	0	NC_013209.1 Acetobacter pasteurianus IFO 3283-01, complete sequence
SRR27593210_trimmed_1.fastq.gz	GCF_000091765.1.fna	1.9966	0.6587	95.66	0.595	95.30-96.04	0.595	0.51-0.66	1	1.319	989/8614	93.26	3	NC_014106.1 Lactobacillus crispatus ST1, complete sequence
SRR27593210_trimmed_1.fastq.gz	GCF_000026405.1.fna	0.7947	0.2433	95.02	0.237	93.86-95.94	0.237	0.16-0.35	2	3.961	355/7943	90.46	10	NC_010471.1 Leuconostoc citreum KM20, complete sequence
SRR27593210_trimmed_1.fastq.gz	GCF_018351295.1.fna	0.1795	0.0972	95.87	0.053	94.07-97.35	0.053	0.03-0.10	1	1.170	206/14497	87.18	15	NZ_CP063750.1 Lactiplantibacillus plantarum strain ATCC 202195 chromosome, complete genome
SRR27593210_trimmed_1.fastq.gz	GCF_000014525.1.fna	0.1679	0.0793	97.84	0.050	95.77-99.72	0.050	0.03-0.08	1	1.065	322/11907	89.01	4	NC_008526.1 Lacticaseibacillus paracasei ATCC 334, complete sequence
